name,instance_count,def,synonyms,image_count,id,frequency,synset
plastic_bag,3631,a bag made of paper or plastic for holding customer's purchases,"['plastic_bag', 'paper_bag']",1469,898,f,sack.n.01
saddle_(on_an_animal),955,a seat for the rider of a horse or camel,['saddle_(on_an_animal)'],521,899,f,saddle.n.01
saddle_blanket,648,stable gear consisting of a blanket placed under the saddle,"['saddle_blanket', 'saddlecloth', 'horse_blanket']",347,900,f,saddle_blanket.n.01
saddlebag,56,a large bag (or pair of bags) hung over a saddle,['saddlebag'],35,901,c,saddlebag.n.01
safety_pin,15,a pin in the form of a clasp; has a guard so the point of the pin will not stick the user,['safety_pin'],7,902,r,safety_pin.n.01
sail,863,a large piece of fabric by means of which wind is used to propel a sailing vessel,['sail'],207,903,f,sail.n.01
salad,171,food mixtures either arranged on a plate or tossed and served with a moist dressing; usually consisting of or including greens,['salad'],108,904,f,salad.n.01
salad_plate,6,a plate or bowl for individual servings of salad,"['salad_plate', 'salad_bowl']",2,905,r,salad_plate.n.01
salami,290,highly seasoned fatty sausage of pork and beef usually dried,['salami'],34,906,c,salami.n.01
salmon_(fish),27,any of various large food and game fishes of northern waters,['salmon_(fish)'],12,907,c,salmon.n.01
salmon_(food),14,flesh of any of various marine or freshwater fish of the family Salmonidae,['salmon_(food)'],10,908,r,salmon.n.03
salsa,22,spicy sauce of tomatoes and onions and chili peppers to accompany Mexican foods,['salsa'],13,909,c,salsa.n.01
saltshaker,543,a shaker with a perforated top for sprinkling salt,['saltshaker'],361,910,f,saltshaker.n.01
sandal_(type_of_shoe),3145,a shoe consisting of a sole fastened by straps to the foot,['sandal_(type_of_shoe)'],1023,911,f,sandal.n.01
sandwich,2315,two (or more) slices of bread with a filling between them,['sandwich'],782,912,f,sandwich.n.01
satchel,3,luggage consisting of a small case with a flat bottom and (usually) a shoulder strap,['satchel'],2,913,r,satchel.n.01
saucepan,26,a deep pan with a handle; used for stewing or boiling,['saucepan'],5,914,r,saucepan.n.01
saucer,555,a small shallow dish for holding a cup at the table,['saucer'],247,915,f,saucer.n.02
sausage,2704,highly seasoned minced meat stuffed in casings,['sausage'],221,916,f,sausage.n.01
sawhorse,5,a framework for holding wood that is being sawed,"['sawhorse', 'sawbuck']",4,917,r,sawhorse.n.01
saxophone,13,a wind instrument with a `J'-shaped form typically made of brass,['saxophone'],8,918,r,sax.n.02
scale_(measuring_instrument),178,a measuring instrument for weighing; shows amount of mass,['scale_(measuring_instrument)'],158,919,f,scale.n.07
scarecrow,4,an effigy in the shape of a man to frighten birds away from seeds,"['scarecrow', 'strawman']",3,920,r,scarecrow.n.01
scarf,1310,a garment worn around the head or neck or shoulders for warmth or decoration,['scarf'],752,921,f,scarf.n.01
school_bus,142,a bus used to transport children to or from school,['school_bus'],64,922,c,school_bus.n.01
scissors,1376,a tool having two crossed pivoting blades with looped handles,['scissors'],707,923,f,scissors.n.01
scoreboard,161,a large board for displaying the score of a contest (and some other information),['scoreboard'],143,924,f,scoreboard.n.01
scraper,1,any of various hand tools for scraping,['scraper'],1,925,r,scraper.n.01
screwdriver,88,a hand tool for driving screws; has a tip that fits into the head of a screw,['screwdriver'],49,926,c,screwdriver.n.01
scrubbing_brush,141,a brush with short stiff bristles for heavy cleaning,['scrubbing_brush'],126,927,f,scrub_brush.n.01
sculpture,202,a three-dimensional work of art,['sculpture'],76,928,c,sculpture.n.01
seabird,126,a bird that frequents coastal waters and the open ocean: gulls; pelicans; gannets; cormorants; albatrosses; petrels; etc.,"['seabird', 'seafowl']",11,929,c,seabird.n.01
seahorse,23,small fish with horse-like heads bent sharply downward and curled tails,['seahorse'],11,930,c,seahorse.n.02
seaplane,4,an airplane that can land on or take off from water,"['seaplane', 'hydroplane']",4,931,r,seaplane.n.01
seashell,451,the shell of a marine organism,['seashell'],39,932,c,seashell.n.01
sewing_machine,11,a textile machine used as a home appliance for sewing,['sewing_machine'],11,933,c,sewing_machine.n.01
shaker,24,a container in which something can be shaken,['shaker'],13,934,c,shaker.n.03
shampoo,254,cleansing agent consisting of soaps or detergents used for washing the hair,['shampoo'],91,935,c,shampoo.n.01
shark,20,typically large carnivorous fishes with sharpe teeth,['shark'],14,936,c,shark.n.01
sharpener,7,any implement that is used to make something (an edge or a point) sharper,['sharpener'],5,937,r,sharpener.n.01
Sharpie,5,a pen with indelible ink that will write on any surface,['Sharpie'],3,938,r,sharpie.n.03
shaver_(electric),12,a razor powered by an electric motor,"['shaver_(electric)', 'electric_shaver', 'electric_razor']",10,939,r,shaver.n.03
shaving_cream,33,toiletry consisting that forms a rich lather for softening the beard before shaving,"['shaving_cream', 'shaving_soap']",18,940,c,shaving_cream.n.01
shawl,9,cloak consisting of an oblong piece of cloth used to cover the head and shoulders,['shawl'],9,941,r,shawl.n.01
shears,38,large scissors with strong blades,['shears'],6,942,r,shears.n.01
sheep,13304,woolly usually horned ruminant mammal related to the goat,['sheep'],951,943,f,sheep.n.01
shepherd_dog,2,any of various usually long-haired breeds of dog reared to herd and guard sheep,"['shepherd_dog', 'sheepdog']",2,944,r,shepherd_dog.n.01
sherbert,2,a frozen dessert made primarily of fruit juice and sugar,"['sherbert', 'sherbet']",1,945,r,sherbert.n.01
shield,41,armor carried on the arm to intercept blows,['shield'],19,946,c,shield.n.02
shirt,10177,a garment worn on the upper half of the body,['shirt'],1942,947,f,shirt.n.01
shoe,9374,common footwear covering the foot,"['shoe', 'sneaker_(type_of_shoe)', 'tennis_shoe']",1916,948,f,shoe.n.01
shopping_bag,377,a bag made of plastic or strong paper (often with handles); used to transport goods after shopping,['shopping_bag'],139,949,f,shopping_bag.n.01
shopping_cart,90,a handcart that holds groceries or other goods while shopping,['shopping_cart'],43,950,c,shopping_cart.n.01
short_pants,5305,trousers that end at or above the knee,"['short_pants', 'shorts_(clothing)', 'trunks_(clothing)']",1969,951,f,short_pants.n.01
shot_glass,24,a small glass adequate to hold a single swallow of whiskey,['shot_glass'],5,952,r,shot_glass.n.01
shoulder_bag,331,a large handbag that can be carried by a strap looped over the shoulder,['shoulder_bag'],134,953,f,shoulder_bag.n.01
shovel,110,"a hand tool for lifting loose material such as snow, dirt, etc.",['shovel'],74,954,c,shovel.n.01
shower_head,450,a plumbing fixture that sprays water over you,['shower_head'],381,955,f,shower.n.01
shower_cap,1,a tight cap worn to keep hair dry while showering,['shower_cap'],1,956,r,shower_cap.n.01
shower_curtain,479,a curtain that keeps water from splashing out of the shower area,['shower_curtain'],381,957,f,shower_curtain.n.01
shredder_(for_paper),6,a device that shreds documents,['shredder_(for_paper)'],6,958,r,shredder.n.01
signboard,8091,structure displaying a board on which advertisements can be posted,['signboard'],1826,959,f,signboard.n.01
silo,95,a cylindrical tower used for storing goods,['silo'],28,960,c,silo.n.01
sink,2182,plumbing fixture consisting of a water basin fixed to a wall or floor and having a drainpipe,['sink'],1635,961,f,sink.n.01
skateboard,3597,a board with wheels that is ridden in a standing or crouching position and propelled by foot,['skateboard'],1967,962,f,skateboard.n.01
skewer,81,a long pin for holding meat in position while it is being roasted,['skewer'],16,963,c,skewer.n.01
ski,8496,sports equipment for skiing on snow,['ski'],1926,964,f,ski.n.01
ski_boot,8124,a stiff boot that is fastened to a ski with a ski binding,['ski_boot'],1789,965,f,ski_boot.n.01
ski_parka,1727,a parka to be worn while skiing,"['ski_parka', 'ski_jacket']",401,966,f,ski_parka.n.01
ski_pole,8263,a pole with metal points used as an aid in skiing,['ski_pole'],1968,967,f,ski_pole.n.01
skirt,1784,a garment hanging from the waist; worn mainly by girls and women,['skirt'],1167,968,f,skirt.n.02
skullcap,1,rounded brimless cap fitting the crown of the head,['skullcap'],1,969,r,skullcap.n.01
sled,102,"a vehicle or flat object for transportation over snow by sliding or pulled by dogs, etc.","['sled', 'sledge', 'sleigh']",56,970,c,sled.n.01
sleeping_bag,33,large padded bag designed to be slept in outdoors,['sleeping_bag'],17,971,c,sleeping_bag.n.01
sling_(bandage),1,bandage to support an injured forearm; slung over the shoulder or neck,"['sling_(bandage)', 'triangular_bandage']",1,972,r,sling.n.05
slipper_(footwear),121,low footwear that can be slipped on and off easily; usually worn indoors,"['slipper_(footwear)', 'carpet_slipper_(footwear)']",58,973,c,slipper.n.01
smoothie,53,a thick smooth drink consisting of fresh fruit pureed with ice cream or yoghurt or milk,['smoothie'],9,974,r,smoothie.n.02
snake,16,limbless scaly elongate reptile; some are venomous,"['snake', 'serpent']",8,975,r,snake.n.01
snowboard,2119,a board that resembles a broad ski or a small surfboard; used in a standing position to slide down snow-covered slopes,['snowboard'],1124,976,f,snowboard.n.01
snowman,61,a figure of a person made of packed snow,['snowman'],31,977,c,snowman.n.01
snowmobile,23,tracked vehicle for travel on snow having skis in front,['snowmobile'],16,978,c,snowmobile.n.01
soap,895,a cleansing agent made from the salts of vegetable or animal fats,['soap'],491,979,f,soap.n.01
soccer_ball,670,an inflated ball used in playing soccer (called `football' outside of the United States),['soccer_ball'],432,980,f,soccer_ball.n.01
sock,6866,cloth covering for the foot; worn inside the shoe; reaches to between the ankle and the knee,['sock'],1945,981,f,sock.n.01
sofa,2408,an upholstered seat for more than one person,"['sofa', 'couch', 'lounge']",1899,982,f,sofa.n.01
softball,5,ball used in playing softball,['softball'],5,983,r,softball.n.01
solar_array,52,electrical device consisting of a large array of connected solar cells,"['solar_array', 'solar_battery', 'solar_panel']",28,984,c,solar_array.n.01
sombrero,22,a straw hat with a tall crown and broad brim; worn in American southwest and in Mexico,['sombrero'],7,985,r,sombrero.n.02
soup,193,liquid food especially of meat or fish or vegetable stock often containing pieces of solid food,['soup'],146,986,f,soup.n.01
soup_bowl,2,a bowl for serving soup,['soup_bowl'],1,987,r,soup_bowl.n.01
soupspoon,44,a spoon with a rounded bowl for eating soup,['soupspoon'],25,988,c,soupspoon.n.01
sour_cream,49,soured light cream,"['sour_cream', 'soured_cream']",22,989,c,sour_cream.n.01
soya_milk,2,a milk substitute containing soybean flour and water; used in some infant formulas and in making tofu,"['soya_milk', 'soybean_milk', 'soymilk']",1,990,r,soya_milk.n.01
space_shuttle,10,a reusable spacecraft with wings for a controlled descent through the Earth's atmosphere,['space_shuttle'],10,991,r,space_shuttle.n.01
sparkler_(fireworks),12,a firework that burns slowly and throws out a shower of sparks,['sparkler_(fireworks)'],9,992,r,sparkler.n.02
spatula,508,a hand tool with a thin flexible blade used to mix or spread soft substances,['spatula'],308,993,f,spatula.n.02
spear,9,a long pointed rod used as a tool or weapon,"['spear', 'lance']",4,994,r,spear.n.01
spectacles,3040,optical instrument consisting of a frame that holds a pair of lenses for correcting defective vision,"['spectacles', 'specs', 'eyeglasses', 'glasses']",1969,995,f,spectacles.n.01
spice_rack,54,a rack for displaying containers filled with spices,['spice_rack'],45,996,c,spice_rack.n.01
spider,19,"predatory arachnid with eight legs, two poison fangs, two feelers, and usually two silk-spinning organs at the back end of the body",['spider'],12,997,c,spider.n.01
crawfish,5,large edible marine crustacean having a spiny carapace but lacking the large pincers of true lobsters,"['crawfish', 'crayfish']",1,998,r,spiny_lobster.n.02
sponge,116,a porous mass usable to absorb water typically used for cleaning,['sponge'],85,999,c,sponge.n.01
spoon,2111,a piece of cutlery with a shallow bowl-shaped container and a handle,['spoon'],1127,1000,f,spoon.n.01
sportswear,85,attire worn for sport or for casual wear,"['sportswear', 'athletic_wear', 'activewear']",11,1001,c,sportswear.n.01
spotlight,403,a lamp that produces a strong beam of light to illuminate a restricted area; used to focus attention of a stage performer,['spotlight'],60,1002,c,spotlight.n.02
squid_(food),6,(Italian cuisine) squid prepared as food,"['squid_(food)', 'calamari', 'calamary']",1,1003,r,squid.n.01
squirrel,19,a kind of arboreal rodent having a long bushy tail,['squirrel'],16,1004,c,squirrel.n.01
stagecoach,1,a large coach-and-four formerly used to carry passengers and mail on regular routes between towns,['stagecoach'],1,1005,r,stagecoach.n.01
stapler_(stapling_machine),68,a machine that inserts staples into sheets of paper in order to fasten them together,['stapler_(stapling_machine)'],65,1006,c,stapler.n.01
starfish,28,echinoderms characterized by five arms extending from a central disk,"['starfish', 'sea_star']",13,1007,c,starfish.n.01
statue_(sculpture),1934,a sculpture representing a human or animal,['statue_(sculpture)'],655,1008,f,statue.n.01
steak_(food),139,a slice of meat cut from the fleshy part of an animal or large fish,['steak_(food)'],51,1009,c,steak.n.01
steak_knife,1,a sharp table knife used in eating steak,['steak_knife'],1,1010,r,steak_knife.n.01
steering_wheel,901,a handwheel that is used for steering,['steering_wheel'],673,1011,f,steering_wheel.n.01
stepladder,5,a folding portable ladder hinged at the top,['stepladder'],5,1012,r,step_ladder.n.01
step_stool,43,a stool that has one or two steps that fold under the seat,['step_stool'],36,1013,c,step_stool.n.01
stereo_(sound_system),77,electronic device for playing audio,['stereo_(sound_system)'],54,1014,c,stereo.n.01
stew,7,food prepared by stewing especially meat or fish with vegetables,['stew'],5,1015,r,stew.n.02
stirrer,18,an implement used for stirring,['stirrer'],8,1016,r,stirrer.n.02
stirrup,625,support consisting of metal loops into which rider's feet go,['stirrup'],305,1017,f,stirrup.n.01
stool,583,a simple seat without a back or arms,['stool'],297,1018,f,stool.n.01
stop_sign,1349,a traffic sign to notify drivers that they must come to a complete stop,['stop_sign'],1053,1019,f,stop_sign.n.01
brake_light,1334,a red light on the rear of a motor vehicle that signals when the brakes are applied,['brake_light'],223,1020,f,stoplight.n.01
stove,1133,a kitchen appliance used for cooking food,"['stove', 'kitchen_stove', 'range_(kitchen_appliance)', 'kitchen_range', 'cooking_stove']",1037,1021,f,stove.n.01
strainer,99,a filter to retain larger pieces while smaller pieces and liquids pass through,['strainer'],63,1022,c,strainer.n.01
strap,7435,an elongated strip of material for binding things together or holding,['strap'],1881,1023,f,strap.n.01
straw_(for_drinking),1154,a thin paper or plastic tube used to suck liquids into the mouth,"['straw_(for_drinking)', 'drinking_straw']",507,1024,f,straw.n.04
strawberry,4386,sweet fleshy red fruit,['strawberry'],333,1025,f,strawberry.n.01
street_sign,8350,a sign visible from the street,['street_sign'],1911,1026,f,street_sign.n.01
streetlight,7381,a lamp supported on a lamppost; for illuminating a street,"['streetlight', 'street_lamp']",1765,1027,f,streetlight.n.01
string_cheese,1,cheese formed in long strings twisted together,['string_cheese'],1,1028,r,string_cheese.n.01
stylus,11,"a pointed tool for writing or drawing or engraving, including pens",['stylus'],5,1029,r,stylus.n.02
subwoofer,1,a loudspeaker that is designed to reproduce very low bass frequencies,['subwoofer'],1,1030,r,subwoofer.n.01
sugar_bowl,10,a dish in which sugar is served,['sugar_bowl'],9,1031,r,sugar_bowl.n.01
sugarcane_(plant),31,juicy canes whose sap is a source of molasses and commercial sugar; fresh canes are sometimes chewed for the juice,['sugarcane_(plant)'],2,1032,r,sugarcane.n.01
suit_(clothing),461,a set of garments (usually including a jacket and trousers or skirt) for outerwear all of the same fabric and color,['suit_(clothing)'],151,1033,f,suit.n.01
sunflower,618,any plant of the genus Helianthus having large flower heads with dark disk florets and showy yellow rays,['sunflower'],82,1034,c,sunflower.n.01
sunglasses,5603,spectacles that are darkened or polarized to protect the eyes from the glare of the sun,['sunglasses'],1931,1035,f,sunglasses.n.01
sunhat,170,a hat with a broad brim that protects the face from direct exposure to the sun,['sunhat'],41,1036,c,sunhat.n.01
surfboard,3835,a narrow buoyant board for riding surf,['surfboard'],1895,1037,f,surfboard.n.01
sushi,337,rice (with raw fish) wrapped in seaweed,['sushi'],24,1038,c,sushi.n.01
mop,22,cleaning implement consisting of absorbent material fastened to a handle; for cleaning floors,['mop'],22,1039,c,swab.n.02
sweat_pants,56,loose-fitting trousers with elastic cuffs; worn by athletes,['sweat_pants'],35,1040,c,sweat_pants.n.01
sweatband,145,a band of material tied around the forehead or wrist to absorb sweat,['sweatband'],69,1041,c,sweatband.n.02
sweater,1894,a crocheted or knitted garment covering the upper part of the body,['sweater'],962,1042,f,sweater.n.01
sweatshirt,1482,cotton knit pullover with long sleeves worn during athletic activity,['sweatshirt'],588,1043,f,sweatshirt.n.01
sweet_potato,137,the edible tuberous root of the sweet potato vine,['sweet_potato'],21,1044,c,sweet_potato.n.02
swimsuit,3141,garment worn for swimming,"['swimsuit', 'swimwear', 'bathing_suit', 'swimming_costume', 'bathing_costume', 'swimming_trunks', 'bathing_trunks']",825,1045,f,swimsuit.n.01
sword,72,a cutting or thrusting weapon that has a long metal blade,['sword'],52,1046,c,sword.n.01
syringe,14,a medical instrument used to inject or withdraw fluids,['syringe'],5,1047,r,syringe.n.01
Tabasco_sauce,5,very spicy sauce (trade name Tabasco) made from fully-aged red peppers,['Tabasco_sauce'],5,1048,r,tabasco.n.02
table-tennis_table,5,a table used for playing table tennis,"['table-tennis_table', 'ping-pong_table']",5,1049,r,table-tennis_table.n.01
table,2804,a piece of furniture having a smooth flat top that is usually supported by one or more vertical legs,['table'],1860,1050,f,table.n.02
table_lamp,81,a lamp that sits on a table,['table_lamp'],56,1051,c,table_lamp.n.01
tablecloth,2496,a covering spread over a dining table,['tablecloth'],1582,1052,f,tablecloth.n.01
tachometer,10,measuring instrument for indicating speed of rotation,['tachometer'],7,1053,r,tachometer.n.01
taco,21,a small tortilla cupped around a filling,['taco'],2,1054,r,taco.n.02
tag,7550,a label associated with something for the purpose of identification or information,['tag'],1562,1055,f,tag.n.02
taillight,9222,lamp (usually red) mounted at the rear of a motor vehicle,"['taillight', 'rear_light']",1885,1056,f,taillight.n.01
tambourine,1,a shallow drum with a single drumhead and with metallic disks in the sides,['tambourine'],1,1057,r,tambourine.n.01
army_tank,7,an enclosed armored military vehicle; has a cannon and moves on caterpillar treads,"['army_tank', 'armored_combat_vehicle', 'armoured_combat_vehicle']",5,1058,r,tank.n.01
tank_(storage_vessel),304,a large (usually metallic) vessel for holding gases or liquids,"['tank_(storage_vessel)', 'storage_tank']",137,1059,f,tank.n.02
tank_top_(clothing),1799,a tight-fitting sleeveless shirt with wide shoulder straps and low neck and no front opening,['tank_top_(clothing)'],1094,1060,f,tank_top.n.01
tape_(sticky_cloth_or_paper),560,a long thin piece of cloth or paper as used for binding or fastening,['tape_(sticky_cloth_or_paper)'],134,1061,f,tape.n.01
tape_measure,35,measuring instrument consisting of a narrow strip (cloth or metal) marked in inches or centimeters and used for measuring lengths,"['tape_measure', 'measuring_tape']",29,1062,c,tape.n.04
tapestry,29,a heavy textile with a woven design; used for curtains and upholstery,['tapestry'],22,1063,c,tapestry.n.02
tarp,1315,waterproofed canvas,['tarp'],522,1064,f,tarpaulin.n.01
tartan,68,a cloth having a crisscross design,"['tartan', 'plaid']",50,1065,c,tartan.n.01
tassel,276,adornment consisting of a bunch of cords fastened at one end,['tassel'],68,1066,c,tassel.n.01
tea_bag,42,a measured amount of tea in a bag for an individual serving of tea,['tea_bag'],16,1067,c,tea_bag.n.01
teacup,152,a cup from which tea is drunk,['teacup'],40,1068,c,teacup.n.02
teakettle,40,kettle for boiling water to make tea,['teakettle'],35,1069,c,teakettle.n.01
teapot,209,pot for brewing tea; usually has a spout and handle,['teapot'],135,1070,f,teapot.n.01
teddy_bear,4886,plaything consisting of a child's toy bear (usually plush and stuffed with soft materials),['teddy_bear'],1413,1071,f,teddy.n.01
telephone,945,electronic device for communicating by voice over long distances (includes wired and wireless/cell phones),"['telephone', 'phone', 'telephone_set']",772,1072,f,telephone.n.01
telephone_booth,62,booth for using a telephone,"['telephone_booth', 'phone_booth', 'call_box', 'telephone_box', 'telephone_kiosk']",50,1073,c,telephone_booth.n.01
telephone_pole,3725,tall pole supporting telephone wires,"['telephone_pole', 'telegraph_pole', 'telegraph_post']",1015,1074,f,telephone_pole.n.01
telephoto_lens,1,a camera lens that magnifies the image,"['telephoto_lens', 'zoom_lens']",1,1075,r,telephoto_lens.n.01
television_camera,117,television equipment for capturing and recording video,"['television_camera', 'tv_camera']",65,1076,c,television_camera.n.01
television_set,2205,an electronic device that receives television signals and displays them on a screen,"['television_set', 'tv', 'tv_set']",1900,1077,f,television_receiver.n.01
tennis_ball,2835,ball about the size of a fist used in playing tennis,['tennis_ball'],1302,1078,f,tennis_ball.n.01
tennis_racket,3035,a racket used to play tennis,['tennis_racket'],1977,1079,f,tennis_racket.n.01
tequila,2,Mexican liquor made from fermented juices of an agave plant,['tequila'],2,1080,r,tequila.n.01
thermometer,33,measuring instrument for measuring temperature,['thermometer'],29,1081,c,thermometer.n.01
thermos_bottle,49,vacuum flask that preserves temperature of hot or cold drinks,['thermos_bottle'],36,1082,c,thermos.n.01
thermostat,153,a regulator for automatically regulating temperature by starting or stopping the supply of heat,['thermostat'],138,1083,f,thermostat.n.01
thimble,6,a small metal cap to protect the finger while sewing; can be used as a small container,['thimble'],4,1084,r,thimble.n.02
thread,320,a fine cord of twisted fibers (of cotton or silk or wool or nylon etc.) used in sewing and weaving,"['thread', 'yarn']",67,1085,c,thread.n.01
thumbtack,224,a tack for attaching papers to a bulletin board or drawing board,"['thumbtack', 'drawing_pin', 'pushpin']",26,1086,c,thumbtack.n.01
tiara,31,a jeweled headdress worn by women on formal occasions,['tiara'],25,1087,c,tiara.n.01
tiger,67,large feline of forests in most of Asia having a tawny coat with black stripes,['tiger'],33,1088,c,tiger.n.02
tights_(clothing),45,skintight knit hose covering the body from the waist to the feet worn by acrobats and dancers and as stockings by women and girls,"['tights_(clothing)', 'leotards']",37,1089,c,tights.n.01
timer,62,a timepiece that measures a time interval and signals its end,"['timer', 'stopwatch']",50,1090,c,timer.n.01
tinfoil,421,foil made of tin or an alloy of tin and lead,['tinfoil'],270,1091,f,tinfoil.n.01
tinsel,70,a showy decoration that is basically valueless,['tinsel'],12,1092,c,tinsel.n.01
tissue_paper,587,a soft thin (usually translucent) paper,['tissue_paper'],316,1093,f,tissue.n.02
toast_(food),125,slice of bread that has been toasted,['toast_(food)'],41,1094,c,toast.n.01
toaster,240,a kitchen appliance (usually electric) for toasting bread,['toaster'],224,1095,f,toaster.n.02
toaster_oven,114,kitchen appliance consisting of a small electric oven for toasting or warming food,['toaster_oven'],105,1096,f,toaster_oven.n.01
toilet,2295,a plumbing fixture for defecation and urination,['toilet'],1925,1097,f,toilet.n.02
toilet_tissue,1683,a soft thin absorbent paper for use in toilets,"['toilet_tissue', 'toilet_paper', 'bathroom_tissue']",1021,1098,f,toilet_tissue.n.01
tomato,12338,mildly acid red or yellow pulpy fruit eaten as a vegetable,['tomato'],1213,1099,f,tomato.n.01
tongs,294,any of various devices for taking hold of objects; usually have two hinged legs with handles above and pointed hooks below,['tongs'],172,1100,f,tongs.n.01
toolbox,39,a box or chest or cabinet for holding hand tools,['toolbox'],28,1101,c,toolbox.n.01
toothbrush,1683,small brush; has long handle; used to clean teeth,['toothbrush'],745,1102,f,toothbrush.n.01
toothpaste,326,a dentifrice in the form of a paste,['toothpaste'],187,1103,f,toothpaste.n.01
toothpick,423,pick consisting of a small strip of wood or plastic; used to pick food from between the teeth,['toothpick'],147,1104,f,toothpick.n.01
cover,306,covering for a hole (especially a hole in the top of a container),['cover'],136,1105,f,top.n.09
tortilla,135,thin unleavened pancake made from cornmeal or wheat flour,['tortilla'],34,1106,c,tortilla.n.01
tow_truck,45,a truck equipped to hoist and pull wrecked cars (or to remove cars from no-parking zones),['tow_truck'],41,1107,c,tow_truck.n.01
towel,2212,a rectangular piece of absorbent cloth (or paper) for drying or wiping,['towel'],636,1108,f,towel.n.01
towel_rack,987,a rack consisting of one or more bars on which towels can be hung,"['towel_rack', 'towel_rail', 'towel_bar']",570,1109,f,towel_rack.n.01
