name,instance_count,def,synonyms,image_count,id,frequency,synset
flash,10,a lamp for providing momentary light to take a photograph,"['flash', 'flashbulb']",8,456,r,flash.n.10
flashlight,48,a small portable battery-powered electric lamp,"['flashlight', 'torch']",37,457,c,flashlight.n.01
fleece,2,a soft bulky fabric with deep pile; used chiefly for clothing,['fleece'],1,458,r,fleece.n.03
flip-flop_(sandal),1103,a backless sandal held to the foot by a thong between two toes,['flip-flop_(sandal)'],346,459,f,flip-flop.n.02
flipper_(footwear),49,a shoe to aid a person in swimming,"['flipper_(footwear)', 'fin_(footwear)']",19,460,c,flipper.n.01
flower_arrangement,3960,a decorative arrangement of flowers,"['flower_arrangement', 'floral_arrangement']",1779,461,f,flower_arrangement.n.01
flute_glass,86,a tall narrow wineglass,"['flute_glass', 'champagne_flute']",23,462,c,flute.n.02
foal,30,a young horse,['foal'],25,463,c,foal.n.01
folding_chair,303,a chair that can be folded flat for storage,['folding_chair'],67,464,c,folding_chair.n.01
food_processor,22,"a kitchen appliance for shredding, blending, chopping, or slicing food",['food_processor'],19,465,c,food_processor.n.01
football_(American),35,the inflated oblong ball used in playing American football,['football_(American)'],28,466,c,football.n.02
football_helmet,7,a padded helmet with a face mask to protect the head of football players,['football_helmet'],4,467,r,football_helmet.n.01
footstool,41,a low seat or a stool to rest the feet of a seated person,"['footstool', 'footrest']",27,468,c,footstool.n.01
fork,3137,cutlery used for serving and eating food,['fork'],1861,469,f,fork.n.01
forklift,14,an industrial vehicle with a power operated fork in front that can be inserted under loads to lift and move them,['forklift'],11,470,c,forklift.n.01
freight_car,121,a railway car that carries freight,['freight_car'],13,471,c,freight_car.n.01
French_toast,41,bread slice dipped in egg and milk and fried,['French_toast'],13,472,c,french_toast.n.01
freshener,39,anything that freshens air by removing or covering odor,"['freshener', 'air_freshener']",32,473,c,freshener.n.01
frisbee,2332,"a light, plastic disk propelled with a flip of the wrist for recreation or competition",['frisbee'],1767,474,f,frisbee.n.01
frog,84,a tailless stout-bodied amphibians with long hind limbs for leaping,"['frog', 'toad', 'toad_frog']",42,475,c,frog.n.01
fruit_juice,37,drink produced by squeezing or crushing fruit,['fruit_juice'],17,476,c,fruit_juice.n.01
frying_pan,310,a pan used for frying foods,"['frying_pan', 'frypan', 'skillet']",128,477,f,frying_pan.n.01
fudge,4,soft creamy candy,['fudge'],1,478,r,fudge.n.01
funnel,9,a cone-shaped utensil used to channel a substance into a container with a small mouth,['funnel'],9,479,r,funnel.n.02
futon,11,a pad that is used for sleeping on the floor or on a raised frame,['futon'],10,480,r,futon.n.01
gag,4,restraint put into a person's mouth to prevent speaking or shouting,"['gag', 'muzzle']",4,481,r,gag.n.02
garbage,18,a receptacle where waste can be discarded,['garbage'],9,482,r,garbage.n.03
garbage_truck,18,a truck for collecting domestic refuse,['garbage_truck'],18,483,c,garbage_truck.n.01
garden_hose,50,a hose used for watering a lawn or garden,['garden_hose'],41,484,c,garden_hose.n.01
gargle,38,a medicated solution used for gargling and rinsing the mouth,"['gargle', 'mouthwash']",28,485,c,gargle.n.01
gargoyle,8,an ornament consisting of a grotesquely carved figure of a person or animal,['gargoyle'],3,486,r,gargoyle.n.02
garlic,487,aromatic bulb used as seasoning,"['garlic', 'ail']",65,487,c,garlic.n.02
gasmask,12,a protective face mask with a filter,"['gasmask', 'respirator', 'gas_helmet']",9,488,r,gasmask.n.01
gazelle,82,small swift graceful antelope of Africa and Asia having lustrous eyes,['gazelle'],23,489,c,gazelle.n.01
gelatin,248,an edible jelly made with gelatin and used as a dessert or salad base or a coating for foods,"['gelatin', 'jelly']",24,490,c,gelatin.n.02
gemstone,2,a crystalline rock that can be cut and polished for jewelry,['gemstone'],1,491,r,gem.n.02
generator,2,engine that converts mechanical energy into electrical energy by electromagnetic induction,['generator'],2,492,r,generator.n.02
giant_panda,112,large black-and-white herbivorous mammal of bamboo forests of China and Tibet,"['giant_panda', 'panda', 'panda_bear']",59,493,c,giant_panda.n.01
gift_wrap,247,attractive wrapping paper suitable for wrapping gifts,['gift_wrap'],48,494,c,gift_wrap.n.01
ginger,93,the root of the common ginger plant; used fresh as a seasoning,"['ginger', 'gingerroot']",17,495,c,ginger.n.03
giraffe,3923,tall animal having a spotted coat and small horns and very long neck and legs,['giraffe'],1877,496,f,giraffe.n.01
cincture,56,a band of material around the waist that strengthens a skirt or trousers,"['cincture', 'sash', 'waistband', 'waistcloth']",18,497,c,girdle.n.02
glass_(drink_container),6420,a container for holding liquids while drinking,"['glass_(drink_container)', 'drinking_glass']",1920,498,f,glass.n.02
globe,59,a sphere on which a map (especially of the earth) is represented,['globe'],50,499,c,globe.n.03
glove,5951,handwear covering the hand,['glove'],1890,500,f,glove.n.02
goat,842,a common goat,['goat'],99,501,c,goat.n.01
goggles,3202,tight-fitting spectacles worn to protect the eyes,['goggles'],1530,502,f,goggles.n.01
goldfish,11,small golden or orange-red freshwater fishes used as pond or aquarium pets,['goldfish'],3,503,r,goldfish.n.01
golf_club,14,golf equipment used by a golfer to hit a golf ball,"['golf_club', 'golf-club']",11,504,c,golf_club.n.02
golfcart,25,a small motor vehicle in which golfers can ride between shots,['golfcart'],19,505,c,golfcart.n.01
gondola_(boat),8,long narrow flat-bottomed boat propelled by sculling; traditionally used on canals of Venice,['gondola_(boat)'],3,506,r,gondola.n.02
goose,413,"loud, web-footed long-necked aquatic birds usually larger than ducks",['goose'],63,507,c,goose.n.01
gorilla,10,largest ape,['gorilla'],5,508,r,gorilla.n.01
gourd,101,any of numerous inedible fruits with hard rinds,['gourd'],6,509,r,gourd.n.02
grape,6377,any of various juicy fruit with green or purple skins; grow in clusters,['grape'],233,510,f,grape.n.01
grater,64,utensil with sharp perforations for shredding foods (as vegetables or cheese),['grater'],54,511,c,grater.n.01
gravestone,778,a stone that is used to mark a grave,"['gravestone', 'headstone', 'tombstone']",36,512,c,gravestone.n.01
gravy_boat,10,a dish (often boat-shaped) for serving gravy or sauce,"['gravy_boat', 'gravy_holder']",10,513,r,gravy_boat.n.01
green_bean,2571,a common bean plant cultivated for its slender green edible pods,['green_bean'],124,514,f,green_bean.n.02
green_onion,1618,a young onion before the bulb has enlarged,"['green_onion', 'spring_onion', 'scallion']",101,515,f,green_onion.n.01
griddle,4,cooking utensil consisting of a flat heated surface on which food is cooked,['griddle'],3,516,r,griddle.n.01
grill,747,a framework of metal bars used as a partition or a grate,"['grill', 'grille', 'grillwork', 'radiator_grille']",363,517,f,grill.n.02
grits,3,coarsely ground corn boiled as a breakfast dish,"['grits', 'hominy_grits']",3,518,r,grits.n.01
grizzly,44,powerful brownish-yellow bear of the uplands of western North America,"['grizzly', 'grizzly_bear']",30,519,c,grizzly.n.01
grocery_bag,46,a sack for holding customer's groceries,['grocery_bag'],18,520,c,grocery_bag.n.01
guitar,315,a stringed instrument usually having six strings; played by strumming or plucking,['guitar'],199,521,f,guitar.n.01
gull,1398,mostly white aquatic bird having long pointed wings and short legs,"['gull', 'seagull']",97,522,c,gull.n.02
gun,68,a weapon that discharges a bullet at high velocity from a metal tube,['gun'],32,523,c,gun.n.01
hairbrush,165,a brush used to groom a person's hair,['hairbrush'],121,524,f,hairbrush.n.01
hairnet,53,a small net that someone wears over their hair to keep it in place,['hairnet'],16,525,c,hairnet.n.01
hairpin,20,a double pronged pin used to hold women's hair in place,['hairpin'],12,526,c,hairpin.n.01
halter_top,3,a woman's top that fastens behind the back and neck leaving the back and arms uncovered,['halter_top'],2,527,r,halter.n.03
ham,1765,meat cut from the thigh of a hog (usually smoked),"['ham', 'jambon', 'gammon']",214,528,f,ham.n.01
hamburger,126,a sandwich consisting of a patty of minced beef served on a bun,"['hamburger', 'beefburger', 'burger']",48,529,c,hamburger.n.01
hammer,41,a hand tool with a heavy head and a handle; used to deliver an impulsive force by striking,['hammer'],26,530,c,hammer.n.02
hammock,15,a hanging bed of canvas or rope netting (usually suspended between two trees),['hammock'],13,531,c,hammock.n.02
hamper,5,a basket usually with a cover,['hamper'],4,532,r,hamper.n.02
hamster,12,short-tailed burrowing rodent with large cheek pouches,['hamster'],11,533,c,hamster.n.01
hair_dryer,144,a hand-held electric blower that can blow warm air onto the hair,['hair_dryer'],123,534,f,hand_blower.n.01
hand_glass,7,a mirror intended to be held in the hand,"['hand_glass', 'hand_mirror']",7,535,r,hand_glass.n.01
hand_towel,619,a small towel used to dry the hands or face,"['hand_towel', 'face_towel']",200,536,f,hand_towel.n.01
handcart,204,wheeled vehicle that can be pushed by a person,"['handcart', 'pushcart', 'hand_truck']",91,537,c,handcart.n.01
handcuff,10,shackle that consists of a metal loop that can be locked around the wrist,['handcuff'],9,538,r,handcuff.n.01
handkerchief,86,a square piece of cloth used for wiping the eyes or nose or as a costume accessory,['handkerchief'],72,539,c,handkerchief.n.01
handle,8314,the appendage to an object that is designed to be held in order to use or move it,"['handle', 'grip', 'handgrip']",1886,540,f,handle.n.01
handsaw,5,a saw used with one hand for cutting wood,"['handsaw', ""carpenter's_saw""]",4,541,r,handsaw.n.01
hardback_book,2,a book with cardboard or cloth or leather covers,"['hardback_book', 'hardcover_book']",1,542,r,hardback.n.01
harmonium,2,a free-reed instrument in which air is forced through the reeds by bellows,"['harmonium', 'organ_(musical_instrument)', 'reed_organ_(musical_instrument)']",1,543,r,harmonium.n.01
hat,7213,"headwear that protects the head from bad weather, sun, or worn for fashion",['hat'],1932,544,f,hat.n.01
hatbox,7,a round piece of luggage for carrying hats,['hatbox'],4,545,r,hatbox.n.01
veil,57,a garment that covers the head OR face,['veil'],56,546,c,head_covering.n.01
headband,1114,a band worn around or over the head,['headband'],854,547,f,headband.n.01
headboard,850,a vertical board or panel forming the head of a bedstead,['headboard'],755,548,f,headboard.n.01
headlight,7326,a powerful light with reflector; attached to the front of an automobile or locomotive,"['headlight', 'headlamp']",1843,549,f,headlight.n.01
headscarf,235,a kerchief worn over the head and tied under the chin,['headscarf'],96,550,c,headscarf.n.01
headset,10,receiver consisting of a pair of headphones,['headset'],7,551,r,headset.n.01
headstall_(for_horses),133,the band that is the part of a bridle that fits around a horse's head,"['headstall_(for_horses)', 'headpiece_(for_horses)']",74,552,c,headstall.n.01
heart,347,a muscular organ; its contractions move the blood through the body,['heart'],66,553,c,heart.n.02
heater,64,device that heats water or supplies warmth to a room,"['heater', 'warmer']",57,554,c,heater.n.01
helicopter,68,an aircraft without wings that obtains its lift from the rotation of overhead blades,['helicopter'],44,555,c,helicopter.n.01
helmet,4845,a protective headgear made of hard material to resist blows,['helmet'],1905,556,f,helmet.n.02
heron,6,grey or white wading bird with long neck and long legs and (usually) long bill,['heron'],4,557,r,heron.n.02
highchair,98,a chair for feeding a very young child,"['highchair', 'feeding_chair']",90,558,c,highchair.n.01
hinge,5283,a joint that holds two parts together so that one can swing relative to the other,['hinge'],1635,559,f,hinge.n.01
hippopotamus,24,massive thick-skinned animal living in or around rivers of tropical Africa,['hippopotamus'],8,560,r,hippopotamus.n.01
hockey_stick,15,sports implement consisting of a stick used by hockey players to move the puck,['hockey_stick'],5,561,r,hockey_stick.n.01
hog,73,domestic swine,"['hog', 'pig']",50,562,c,hog.n.03
home_plate_(baseball),551,(baseball) a rubber slab where the batter stands; it must be touched by a base runner in order to score,"['home_plate_(baseball)', 'home_base_(baseball)']",545,563,f,home_plate.n.01
honey,90,a sweet yellow liquid produced by bees,['honey'],20,564,c,honey.n.01
fume_hood,208,metal covering leading to a vent that exhausts smoke or fumes,"['fume_hood', 'exhaust_hood']",193,565,f,hood.n.06
hook,1157,a curved or bent implement for suspending or pulling something,['hook'],285,566,f,hook.n.05
hookah,3,a tobacco pipe with a long flexible tube connected to a container where the smoke is cooled by passing through water,"['hookah', 'narghile', 'nargileh', 'sheesha', 'shisha', 'water_pipe']",3,567,r,hookah.n.01
hornet,1,large stinging wasp,['hornet'],1,568,r,hornet.n.01
horse,4744,a common horse,['horse'],1904,569,f,horse.n.01
hose,610,a flexible pipe for conveying a liquid or gas,"['hose', 'hosepipe']",294,570,f,hose.n.03
hot-air_balloon,4,balloon for travel through the air in a basket suspended below a large bag of heated air,['hot-air_balloon'],3,571,r,hot-air_balloon.n.01
hotplate,6,a portable electric appliance for heating or cooking or keeping food warm,['hotplate'],5,572,r,hot_plate.n.01
hot_sauce,70,a pungent peppery sauce,['hot_sauce'],24,573,c,hot_sauce.n.01
hourglass,2,a sandglass timer that runs for sixty minutes,['hourglass'],2,574,r,hourglass.n.01
houseboat,4,a barge that is designed and equipped for use as a dwelling,['houseboat'],2,575,r,houseboat.n.01
hummingbird,18,tiny American bird having brilliant iridescent plumage and long slender bills,['hummingbird'],16,576,c,hummingbird.n.01
hummus,9,a thick spread made from mashed chickpeas,"['hummus', 'humus', 'hommos', 'hoummos', 'humous']",8,577,r,hummus.n.01
polar_bear,196,white bear of Arctic regions,['polar_bear'],154,578,f,ice_bear.n.01
icecream,180,frozen dessert containing cream and sugar and flavoring,['icecream'],66,579,c,ice_cream.n.01
popsicle,1,ice cream or water ice on a small wooden stick,['popsicle'],1,580,r,ice_lolly.n.01
ice_maker,26,an appliance included in some electric refrigerators for making ice cubes,['ice_maker'],24,581,c,ice_maker.n.01
ice_pack,4,a waterproof bag filled with ice: applied to the body (especially the head) to cool or reduce swelling,"['ice_pack', 'ice_bag']",1,582,r,ice_pack.n.01
ice_skate,14,skate consisting of a boot with a steel blade fitted to the sole,['ice_skate'],4,583,r,ice_skate.n.01
igniter,77,a substance or device used to start a fire,"['igniter', 'ignitor', 'lighter']",75,584,c,igniter.n.01
inhaler,7,a dispenser that produces a chemical vapor to be inhaled through mouth or nose,"['inhaler', 'inhalator']",6,585,r,inhaler.n.01
iPod,172,a pocket-sized device used to play music files,['iPod'],126,586,f,ipod.n.01
iron_(for_clothing),38,home appliance consisting of a flat metal base that is heated and used to smooth cloth,"['iron_(for_clothing)', 'smoothing_iron_(for_clothing)']",24,587,c,iron.n.04
ironing_board,24,narrow padded board on collapsible supports; used for ironing clothes,['ironing_board'],22,588,c,ironing_board.n.01
jacket,8013,a waist-length coat,['jacket'],1872,589,f,jacket.n.01
jam,29,preserve of crushed fruit,['jam'],16,590,c,jam.n.01
jar,2002,a vessel (usually cylindrical) with a wide mouth and without handles,['jar'],423,591,f,jar.n.01
jean,5421,(usually plural) close-fitting trousers of heavy denim for manual work or casual wear,"['jean', 'blue_jean', 'denim']",1927,592,f,jean.n.01
jeep,55,a car suitable for traveling over rough terrain,"['jeep', 'landrover']",38,593,c,jeep.n.01
jelly_bean,116,sugar-glazed jellied candy,"['jelly_bean', 'jelly_egg']",3,594,r,jelly_bean.n.01
jersey,8117,a close-fitting pullover shirt,"['jersey', 'T-shirt', 'tee_shirt']",1945,595,f,jersey.n.03
jet_plane,87,an airplane powered by one or more jet engines,"['jet_plane', 'jet-propelled_plane']",35,596,c,jet.n.01
jewel,1,a precious or semiprecious stone incorporated into a piece of jewelry,"['jewel', 'gem', 'precious_stone']",1,597,r,jewel.n.01
jewelry,51,an adornment (as a bracelet or ring or necklace) made of precious metals and set with gems (or imitation gems),"['jewelry', 'jewellery']",13,598,c,jewelry.n.01
joystick,12,a control device for computers consisting of a vertical handle that can move freely in two directions,['joystick'],9,599,r,joystick.n.02
jumpsuit,21,one-piece garment fashioned after a parachutist's uniform,['jumpsuit'],14,600,c,jump_suit.n.01
kayak,124,a small canoe consisting of a light frame made watertight with animal skins,['kayak'],37,601,c,kayak.n.01
keg,6,small cask or barrel,['keg'],3,602,r,keg.n.02
kennel,4,outbuilding that serves as a shelter for a dog,"['kennel', 'doghouse']",4,603,r,kennel.n.01
kettle,130,a metal pot for stewing or boiling; usually has a lid,"['kettle', 'boiler']",100,604,c,kettle.n.01
key,447,metal instrument used to unlock a lock,['key'],195,605,f,key.n.01
keycard,1,a plastic card used to gain access typically to a door,['keycard'],1,606,r,keycard.n.01
kilt,19,a knee-length pleated tartan skirt worn by men as part of the traditional dress in the Highlands of northern Scotland,['kilt'],12,607,c,kilt.n.01
kimono,38,a loose robe; imitated from robes originally worn by Japanese,['kimono'],24,608,c,kimono.n.01
kitchen_sink,519,a sink in a kitchen,['kitchen_sink'],489,609,f,kitchen_sink.n.01
kitchen_table,11,a table in the kitchen,['kitchen_table'],10,610,r,kitchen_table.n.01
kite,11174,plaything consisting of a light frame covered with tissue paper; flown in wind at end of a string,['kite'],1689,611,f,kite.n.03
kitten,60,young domestic cat,"['kitten', 'kitty']",42,612,c,kitten.n.01
kiwi_fruit,702,fuzzy brown egg-shaped fruit with slightly tart green flesh,['kiwi_fruit'],81,613,c,kiwi.n.03
knee_pad,1765,protective garment consisting of a pad worn by football or baseball or hockey players,['knee_pad'],894,614,f,knee_pad.n.01
knife,3515,tool with a blade and point used as a cutting instrument,['knife'],1868,615,f,knife.n.01
knitting_needle,16,needle consisting of a slender rod with pointed ends; usually used in pairs,['knitting_needle'],7,616,r,knitting_needle.n.01
knob,8432,a round handle often found on a door,['knob'],1567,617,f,knob.n.02
knocker_(on_a_door),10,a device (usually metal and ornamental) attached by a hinge to a door,"['knocker_(on_a_door)', 'doorknocker']",10,618,r,knocker.n.05
koala,15,sluggish tailless Australian marsupial with grey furry ears and coat,"['koala', 'koala_bear']",8,619,r,koala.n.01
lab_coat,42,a light coat worn to protect clothing from substances used while working in a laboratory,"['lab_coat', 'laboratory_coat']",7,620,r,lab_coat.n.01
ladder,975,steps consisting of two parallel members connected by rungs,['ladder'],629,621,f,ladder.n.01
ladle,226,a spoon-shaped vessel with a long handle frequently used to transfer liquids,['ladle'],89,622,c,ladle.n.01
ladybug,68,"small round bright-colored and spotted beetle, typically red and black","['ladybug', 'ladybeetle', 'ladybird_beetle']",15,623,c,ladybug.n.01
lamb_(animal),618,young sheep,['lamb_(animal)'],134,624,f,lamb.n.01
lamb-chop,8,chop cut from a lamb,"['lamb-chop', 'lambchop']",4,625,r,lamb_chop.n.01
lamp,4139,a piece of furniture holding one or more electric light bulbs,['lamp'],1802,626,f,lamp.n.02
lamppost,2234,a metal post supporting an outdoor lamp (such as a streetlight),['lamppost'],595,627,f,lamppost.n.01
lampshade,2475,a protective ornamental shade used to screen a light bulb from direct view,['lampshade'],1210,628,f,lampshade.n.01
lantern,364,light in a transparent protective case,['lantern'],48,629,c,lantern.n.01
lanyard,1065,"a cord worn around the neck to hold a knife or whistle, etc.","['lanyard', 'laniard']",418,630,f,lanyard.n.02
laptop_computer,2852,a portable computer small enough to use in your lap,"['laptop_computer', 'notebook_computer']",1846,631,f,laptop.n.01
lasagna,7,baked dish of layers of lasagna pasta with sauce and cheese and meat or vegetables,"['lasagna', 'lasagne']",5,632,r,lasagna.n.01
latch,702,a bar that can be lowered or slid into a groove to fasten a door or gate,['latch'],221,633,f,latch.n.02
lawn_mower,12,garden tool for mowing grass on lawns,['lawn_mower'],10,634,r,lawn_mower.n.01
leather,20,an animal skin made smooth and flexible by removing the hair and then tanning,['leather'],7,635,r,leather.n.01
legging_(clothing),154,a garment covering the leg (usually extending from the knee to the ankle),"['legging_(clothing)', 'leging_(clothing)', 'leg_covering']",76,636,c,legging.n.01
Lego,331,a child's plastic construction set for making models from blocks,"['Lego', 'Lego_set']",22,637,c,lego.n.01
legume,333,the fruit or seed of bean or pea plants,['legume'],10,638,r,legume.n.02
lemon,2168,yellow oval fruit with juicy acidic flesh,['lemon'],341,639,f,lemon.n.01
lemonade,2,sweetened beverage of diluted lemon juice,['lemonade'],1,640,r,lemonade.n.01
lettuce,5500,leafy plant commonly eaten in salad or on sandwiches,['lettuce'],705,641,f,lettuce.n.02
license_plate,4392,a plate mounted on the front and back of car and bearing the car's registration number,"['license_plate', 'numberplate']",1900,642,f,license_plate.n.01
life_buoy,524,a ring-shaped life preserver used to prevent drowning (NOT a life-jacket or vest),"['life_buoy', 'lifesaver', 'life_belt', 'life_ring']",188,643,f,life_buoy.n.01
life_jacket,689,life preserver consisting of a sleeveless jacket of buoyant or inflatable design,"['life_jacket', 'life_vest']",227,644,f,life_jacket.n.01
lightbulb,7075,lightblub/source of light,['lightbulb'],861,645,f,light_bulb.n.01
lightning_rod,6,a metallic conductor that is attached to a high point and leads to the ground,"['lightning_rod', 'lightning_conductor']",6,646,r,lightning_rod.n.02
lime,1134,the green acidic fruit of any of various lime trees,['lime'],115,647,f,lime.n.06
limousine,6,long luxurious car; usually driven by a chauffeur,['limousine'],5,648,r,limousine.n.01
lion,69,large gregarious predatory cat of Africa and India,['lion'],43,649,c,lion.n.01
lip_balm,29,a balm applied to the lips,['lip_balm'],14,650,c,lip_balm.n.01
liquor,66,liquor or beer,"['liquor', 'spirits', 'hard_liquor', 'liqueur', 'cordial']",6,651,r,liquor.n.01
lizard,22,a reptile with usually two pairs of legs and a tapering tail,['lizard'],15,652,c,lizard.n.01
log,7363,a segment of the trunk of a tree when stripped of branches,['log'],1167,653,f,log.n.01
lollipop,59,hard candy on a stick,['lollipop'],15,654,c,lollipop.n.02
speaker_(stero_equipment),2029,electronic device that produces sound often as part of a stereo system,['speaker_(stero_equipment)'],994,655,f,loudspeaker.n.01
loveseat,41,small sofa that seats two people,['loveseat'],28,656,c,love_seat.n.01
machine_gun,5,a rapidly firing automatic gun,['machine_gun'],2,657,r,machine_gun.n.01
magazine,1379,a paperback periodic publication,['magazine'],338,658,f,magazine.n.02
magnet,5638,a device that attracts iron and produces a magnetic field,['magnet'],334,659,f,magnet.n.01
mail_slot,16,a slot (usually in a door) through which mail can be delivered,['mail_slot'],15,660,c,mail_slot.n.01
mailbox_(at_home),240,a private box for delivery of mail,"['mailbox_(at_home)', 'letter_box_(at_home)']",102,661,f,mailbox.n.01
mallard,2,wild dabbling duck from which domestic ducks are descended,['mallard'],1,662,r,mallard.n.01
mallet,16,a sports implement with a long handle and a hammer-like head used to hit a ball,['mallet'],8,663,r,mallet.n.01
mammoth,2,any of numerous extinct elephants widely distributed in the Pleistocene,['mammoth'],1,664,r,mammoth.n.01
manatee,1,sirenian mammal of tropical coastal waters of America,['manatee'],1,665,r,manatee.n.01
mandarin_orange,401,a somewhat flat reddish-orange loose skinned citrus of China,['mandarin_orange'],28,666,c,mandarin.n.05
manger,126,a container (usually in a barn or stable) from which cattle or horses feed,"['manger', 'trough']",91,667,c,manger.n.01
manhole,445,a hole (usually with a flush cover) through which a person can gain access to an underground structure,['manhole'],260,668,f,manhole.n.01
map,186,a diagrammatic representation of the earth's surface (or part of it),['map'],131,669,f,map.n.01
marker,501,a writing implement for making a mark,['marker'],128,670,f,marker.n.03
martini,3,a cocktail made of gin (or vodka) with dry vermouth,['martini'],3,671,r,martini.n.01
mascot,10,a person or animal that is adopted by a team or other group as a symbolic figure,['mascot'],10,672,r,mascot.n.01
mashed_potato,58,potato that has been peeled and boiled and then mashed,['mashed_potato'],39,673,c,mashed_potato.n.01
masher,2,a kitchen utensil used for mashing (e.g. potatoes),['masher'],2,674,r,masher.n.02
mask,1595,a protective covering worn over the face,"['mask', 'facemask']",925,675,f,mask.n.04
mast,2985,a vertical spar for supporting sails,['mast'],354,676,f,mast.n.01
mat_(gym_equipment),114,sports equipment consisting of a piece of thick padding on the floor for gymnastics,"['mat_(gym_equipment)', 'gym_mat']",31,677,c,mat.n.03
matchbox,11,a box for holding matches,['matchbox'],10,678,r,matchbox.n.01
mattress,354,a thick pad filled with resilient material used as a bed or part of a bed,['mattress'],215,679,f,mattress.n.01
measuring_cup,139,graduated cup used to measure liquid or granular ingredients,['measuring_cup'],71,680,c,measuring_cup.n.01
measuring_stick,57,measuring instrument having a sequence of marks at regular intervals,"['measuring_stick', 'ruler_(measuring_stick)', 'measuring_rod']",43,681,c,measuring_stick.n.01
